{
  "$schema": "https://json-schema.org/draft/2020-12/schema",
  "$defs": {
    "contact": {
      "type": "object",
      "properties": {
        "email": {
          "type": "string"
        },
        "phone": {
          "type": "string"
        },
        "location": {
          "type": "string"
        },
        "links": {
          "type": "array",
          "items": {
            "type": "object",
            "required": [
              "label",
              "url"
            ],
            "properties": {
              "label": {
                "type": "string"
              },
              "url": {
                "type": "string"
              }
            }
          }
        }
      }
    },
    "job": {
      "type": "object",
      "required": [
        "company"
      ],
      "properties": {
        "company": {
          "type": "string"
        },
        "role": {
          "type": "string"
        },
        "period": {
          "type": "string"
        },
        "highlights": {
          "type": "array",
          "items": {
            "type": "string"
          }
        }
      }
    }
  },
  "type": "object",
  "required": [
    "name"
  ],
  "properties": {
    "name": {
      "type": "string"
    },
    "title": {
      "type": "string"
    },
    "contact": {
      "$ref": "#/$defs/contact"
    },
    "summary": {
      "type": "string"
    },
    "work": {
      "type": "array",
      "items": {
        "$ref": "#/$defs/job"
      }
    },
    "skills": {
      "type": "array",
      "items": {
        "type": "string"
      }
    }
  }
}
